Question	rel_label
what is published by Dark Horse Comics	1499
What was planned in 1971	970
what had a surplus of gold	1500
What did Murphy have 	1501
where has a rich culture of music	1502
For whom was An exception made  	148
when did Squad announce 	20
what does The Royal Canadian Artillery not carry 	1503
When did Lennon buy the house	1504
from whom does A letter come	1357
What was admitted in 1876	1283
Where did Godwin later attend 	1505
what run along Station Street	1506
who was born in Biloxi	1
who  is from Saudi Arabia	359
what is a division of Commonwealth Business Media	1507
Who never went to Chicago	1508
what began on 1 January	349
who emigrates to Canada	579
what depends critically on monotonicity	1509
of what is Venus ' atmosphere  mostly composed	1510
When did Janicki sign his first professional contract 	28
where is Zenn-La	1511
who was president of the United States Conference of Mayors	620
what is Mutation	1512
Where was Mr. Rex  constructed  	95
where do Jumping spiders  live 	51
what is Dalton	498
What do Rock iguanas have	1513
What is  is served by the Denton Independent School District	1514
What is Claysburg	32
Where did Walker go straight  	1515
into what is Josh made  	1516
Where seemed far from crisis	1517
who  was born in Poulton-le-Fylde	1
where was Rockwell born 	1
To what is Access subject	1471
What is for 2001	1175
What is Guru Gobind Singh Indraprastha University 	1518
who are allowed to work in Islam	1519
What is lacking a publisher	1520
when was Work completed 	1296
what is Simple Pleasure	1521
who  served on the House Veterans Affairs Committee	1522
To what is Malaysia not a party  	1523
How is Microsoft Office 14 currently  	1524
where did Gras open his first restaurant 	1525
what is a borough in Jefferson County	350
What established a Ministry of Family	1526
what is Enon	197
what did Tower receive 	1527
What are also provided by The Australian National University	1528
what is Kappa	197
after what does Quattro come	1529
What is subject to ridicule	1471
who selected one of three boxes	1530
when were A total of 3513 built 	1531
What was active in Flanders	1532
Who was Stephens	1533
what are References not	173
what is Hernando County	1534
What was established in 1981	218
who was born in Fountainbridge	1
where was granted the status of a municipality	1535
Who  was born in Haynesville	1
who hate Bucky Dent	1536
What was stationed at Portland	1537
who  bursts into tears	1538
what is geographically located in San Mateo County	1539
where has a wide variety of flora	1540
what is based in Weybridge	232
what are an American professional basketball team based in East Rutherford	1541
What was upgraded in 1959-60	1542
What is played in two varieties	1543
Where did Instruments vary 	724
What animals can be trained for falconry	1544
how was Serrano	659
Who focused particularly on the Bowery	1545
where is Elm Creek	197
What is A Multiverse	44
what is  an area of Louisville	1546
Who is Leary	431
who met in Lima	647
wha happened to Vince Young	1547
what is Green Action	1548
who is a Phi Beta Kappa graduate of Brandeis University	1549
Where are Foreign students enrolled 	1550
When did Banbury die 	424
what did Bird sign to	1551
what introduces the elements of style	1552
What is steadily growing in population	1553
Where was Pharmacia 	1554
who then studied at Hastings College of the Law	1555
how are Seats designed  	1556
What is a public school in Philadelphia	1557
what are S-130 and S-190	1558
What is a part of WikiProject Nickelodeon	370
what is Lowdown	466
who is Mildred	1022
Where has a station on Metra 's SouthWest Service	1559
from where Cottonmouth hails  	1560
what is revealed to Zero	1278
when was The Temple founded	308
What is Estancia	60
what is delivered by trained volunteers	1561
What is an A road in London	1562
what does Minnesota currently have	572
what is a village in the English county of Suffolk	197
what is U.S. Route 340	1563
what does Kawkhali have 	871
What was no longer seen as a respectable profession	1564
in what has Davis stood	601
what is 86th Street	559
what did Clarke fail to pay	1565
What was assigned to Tsingtao	1197
Where is Bow located	68
who was born in Purmerend	1
how is Public bus service provided 	581
who was accused of sorcery	1566
where was Kirkland born	1
where did Taney soon proceed	1567
what is Hale	1010
What is Hayes	60
what is The Bronze	944
where did Rason die 	510
who is Zivkovic	942
who went to Philadelphia	85
with what is WIN also associated 	1568
What is Berlin Township	43
when  was Titanic re-discovered	1569
from what does Policy flow	769
in what were Presented papers  later published	1570
what did Ramones also suffer	1273
What did officially break up in July 1983	1571
for what did Addis sue 	960
Between what is Memphis split  	1082
for what did Earl Holliman win the Golden Globe Award 	1572
by whom is The Commander  captured 	1573
for whom did Lawe get underway 	1574
where is Uniontown	32
what is Logan	60
Who married firstly Elizabeth	430
when is The DVD set to be released 	1575
where are Main offices 	659
what town is in Ottawa County	60
who currently plays for Benetton Treviso	911
to whom did an idea occur 	998
How much does DeShaun Foster rush	1576
when did Construction of the Plant start	208
who also migrated to industrial cities	1577
Of what is Cinderella Castle the icon  	1578
who left Los Angeles for San Francisco	1579
Where does Hacker live	51
how are Competition matches played	1543
how much were Damages estimated  	1580
For how long is Trading halted 	1581
who became a member of the Avengers	1582
what is The Tongariro River	1349
Who was an active member of the Whig Party	1583
Who filed for bankruptcy protection	1396
how many people live in Oberndorf	51
who moved to Naples	33
where are Headquarters staff  based 	161
where did Heimdall spend more time 	1584
who moved to Milan	33
what does Fripp Island have 	1585
what does Bane destroy	606
what is Krell	1586
where is The DVLA based 	232
For what is Patty Wetterling an advocate  	1587
of what  is The Concert Choir  made up 	735
who entered the House on Day 12	1063
What was Tullidge baptized  	1435
who died in exile	18
What is for seal	1175
on what are An tags  	1588
What is the third solo album by Bizzy Bone	1589
to whom was Koxinga born	1193
What is Commerce City	1590
what has existed since Anglo-Saxon times	1591
Who is a past president of the Mystery Writers of America	31
who was Chancellor	518
what runs through downtown	1592
what is a village in Christian County	197
Where had a population of 637	871
What closed in 1971	1593
who was Boland	1594
who is Scip	1595
who also wrote on rhetoric	1596
What is Inferno	1597
What does Confucianism reject	1598
Where is Orangefield	1599
What is Shasta High School	1600
What are subject to scope	1471
when did Memories begin 	349
What has Census not forgotten	405
What are only on clothes	1588
where was Hastings born  	1
How did Colls eventually finish	1601
what does Bamboo symbolize	1602
what included the England	1603
what did The Eagles drop to	1604
For what MLS set their own rules 	1605
What is State Route 241	1093
what consists of 80 Members	13
who broke from tradition	1606
what did Saris do	1607
what is considered the cradle of civilization	1608
when did Konstantin enter the House  	1063
to what is Shikamaru closest	1609
what  is the modern equivalent of gnostic teaching	1610
what is documented in The Hawk	1611
what is provided by Pierce Transit	581
where does Zun currently reside	423
whom does Louis IX expel from France	1612
to what was Chole probably the closest 	1613
when was The Kingdom of EnenKio first conceived	1614
When is HaIr published 	756
where was Duncan raised  	365
where was Aprile born	1
for what did A database backend optimize	669
what is the Book of Job	1615
on what will Samoa be  	1616
where did Sam grow up	194
What is Otari	1288
how many members does The Society currently have 	1617
who lives in Santa Fe	51
what does appear in peer-reviewed articles	1618
Comaring to what is Life nothing	1619
Who died peacefully 17 June 1971	1620
what does The Centre sponsor 	1621
What may also be compared to military law	1622
Where was Eastman assigned to	1197
where is Attica	197
who has been operating since 1900	1623
what is Vend 	1624
What is the area adjacent to the M4 motorway	1625
for what is Coamo a trading center	1626
who injured Horus	824
what begins in Canada	608
what is Andres all surrounded by	1627
When was Rhame founded  	308
When did Linda die	424
what did Himiko assume	1628
What has been the subject of customer complaints	1629
when was STS-121 launched 	1630
What was commissioned on 22 January 1983	745
what may Distributions include 	1476
When was Chi Omega organized	1631
Where has a population of about 5000	658
what is Organometallics	1632
for what was Kameo originally slated  	1633
who was December 1627	1634
for how much did The College settle the case 	1635
To where Bunting brought change  	1636
what is Windows Vista	617
who is a fan of Crystal Palace Football Club	503
for what can Electroencephalography be used	1139
What has traditionally been an agricultural economy	1637
Who  is an American writer of fantasy	1638
Against whom has Andrew Cuomo spoken out	1639
what did South African mines have	1500
What is Central	1640
who is Cracchiolo	139
Where is the birthplace of the Jesus Army	1641
what did Pridiyathorn oppose 	1642
To whom was Kevin Taylor  known 	1643
Who believes in America	1644
What is Overland	1645
What was Boothby appointed  	1646
what did Fare pay for	827
what does The Lieutenant Governor have 	1647
who  was born in Galanta	1
What was about 60 mph	881
what formed part of Montgomeryshire	1198
what is the national airline of Saudi Arabia	1648
What consist of 24 neighborhoods	13
what  are classified into three genera	1649
who was born in Walworth	1
Who was returned to the Peloponnesian League	1650
who was nominated to the Western Australian Legislative Council	1651
who  brought a lot of fresh ideas	1652
who  was Governor of Queensland	1653
for what was Smith indicted 	1654
what has an apparent magnitude of 6.2	1655
What are Calderas	1656
what can be found on the Society 's website	1657
what is placed outside of the H	1658
what did Oates play	1659
What was founded in 1889	308
Who  was living in Vienne	309
who arrived in Naples	778
where is home to the University of Geneva	73
What can perform a wide array of missions	1660
How are Stockpots typically measured 	1661
What country invaded the islands in April 1982	1662
Who could produce thunder	1168
What are used sometimes for pronunciation	1663
who seized the city in 1537	395
How long did IBJ run 	1664
Who comes from Moon	1357
what is Saks	1665
what public high school is located in Charleston	1666
When  was Linacre College founded 	308
who is now part of Thales Group	1667
what include parts of Switzerland	1668
To where are Survivors forced to flee 	1669
what  were fitted with front disc brakes	1670
what is The Faroe Islands 	1671
what did The Japanese  fail to reach 	1672
What were found at operation	1673
what got Devon	1674
When was Californication released 	228
to whom did Colten sell the newspapers	656
what is a census-designated place in Merced County	32
where did Artemis first appear	50
To what are Human eyes  more sensitive 	1675
who  is an avid collector of weaponry	634
when was The NY 380 designation  removed	1676
When did Jimnez make his major league debut 	144
Whom does Hades bring back 	1677
what did King Corn receive 	1678
What becomes independent from the Kingdom of Len	340
what is a theme in science fiction	1512
where did Russian troops occupy 	1679
from what was Sundbyberg detached	1680
Where is Palazzo Braschi located  	1425
where did Watson move back to	1123
What had 1000 Clowns played 	1140
What is Gov. John Hoeven working on 	1681
to where did Seymour come back 	1682
who is brought in for a consult	1683
For what is Marie the French  term	1684
Who is the son of Robert Runcie	942
Who was born in Wembley	1
Where did Johansen die 	18
where is Peak	60
where does A similar situation occur	551
What paid for Thomas Hunt	827
who was a United States Representative from Connecticut	1685
what  is the constitution of the Republic of India	1686
what  is currently searching for a title sponsor	1687
Where was Midnight ordered 	1688
where had Washington reached 	1689
Where is Chinquapin	140
who  defeated Team Canada	974
What is Gladstone	134
what shut down September 17 , 2006	1690
how will The Games be organised 	1691
where is The Feldberg situated 	1692
What closed until further notice	1693
who was chosen for make-up	1694
To whom did Septimania pass	1695
by what  is Jamie sponsored	274
What is Just One Night	985
who once wrote of Kentucky	1696
Where is Lisbon	134
When were Operations suspended 	432
for what is The Breeders ' Cup currently searching 	1687
what isn't related to death metal	1697
who had a crush on Vince	994
who is Ma Ying-jeou 	139
what serves Yeadon	626
Where did Howard play collegiately 	1698
Who was the Prime Minister of the United Kingdom	138
what are usually composed of four to eight students	1699
what town is in Wetzel County	60
What census-designated place is in Dewey County	32
where had Protestantism been gaining ground	1700
what is Bay Saint Louis	472
What were divided between the Main Stage	571
where did Campbell grow up 	194
who was killed on April 21 , 1996	794
In which movie does Krypto make a brief appearance in Justice League of America	1701
who died on 24 September 366	424
what is A student 's schedule based on 	902
what was Major Robinson promoted to	1114
for what did Taussig stand out 	1702
who grew up in Tanzania	194
what is Spanish for Blood	1703
to whom Seck belongs  	112
what is made up of HR professionals	735
Of  what was Benson a lifelong supporter	1704
What is not a type of software	109
what did Tongans also eat 	1705
when has Construction begun  	1706
where did Dillon die	18
What is Fox	1707
what were accepted for construction	1708
Where were Five tornadoes reported	1709
for what has Omid had a life-long passion  	1368
what  are Echidnas classified into 	1649
what occurs in Belgium	551
by whom was Cornelius not liked  	1710
who won the Golden Globe Award for Best Supporting Actor	1572
where did Desmond start working  	920
who is Posner	186
Who is currently voiced by actress	1711
who have appeared in three NCAA Tournaments	809
who was Feldt	942
Who were declared unfit for combat duty	1712
where does U.S. Route 119  also reach	1713
what is  a hamlet on the Shetland Islands	1714
who earned his master degree from University of Notre Dame	1715
how Works are listed 	482
What fell into British hands	1716
who eventually replaced Anne Bancroft	1717
what are The Johns 	1718
where is The Peugeot 206 also being produced	1719
Where is Len	1720
what is well connected through Rail	1721
What is Delavan	134
what can Unified communications include 	1722
what  are not held in public	1723
where is the spiritual home of Sikhs	1724
What was destroyed on Ramree Island	1725
what  is not equipped for water ballast	1726
when was A ceasefire arranged 	1727
who  died in 1748	18
what Wiki articles  should n't be 	1728
who is Hall a native of Abilene	79
where was Del Sol  born 	1
Where is Louise	32
who also encouraged fiction	1729
To what was Optimality Theory originally applied 	1730
who is the current manager of the Philadelphia Phillies of Major League Baseball	1731
For how long does A season last	1359
who was called out for interference	1732
Where did Cinnabon first open	1733
where do Similar laws now exist	1201
when did Bruce die  	18
what  are depicted in a row	1734
what country grows lots of corn	1735
Where did Aris lost the game	1736
what is a good conductor of sodium ions	1071
what are uncommon in China	1737
where did Mount Hood reflect 	1738
Where does Anne currently live	236
where  has Ian accounts	1739
who walks over to a computer	1740
how did Gwaltney die	18
who was born in Lakenheath	1
who  was knighted in 2000	1415
Where is Larsen Bay	134
what could Central computers do	302
how many pairs breed on Heard Island	585
What can take a range of forms	1741
What was a pharmaceutical company in Sweden	1554
who was born in East Flatbush	1
Who has held a variety of political positions	1742
what  took around two years	1743
Where is Grange	197
when did Undocking occur	1406
Who published a book in 2003	1744
what does MS 35 serve	1745
who died in Monrovia	18
who is Tetsuo	1746
What is the study of animal behavior	1495
what  include a Making of documentary	1747
where does Curtis wander 	1748
where do People generally stay	1749
when was Homosexuality decriminalized  	1750
what  would be a good thing	1751
who was flown to London	943
who  inspired a number of authors	1752
who was born in Morden	1
when was Business incubator  founded	308
where is Paullina	134
where did Knox lead a busy life	34
Who is the son of Aenarion	942
who is good friends with Vinnie Colaiuta	317
who is now involved in an international charity	1753
What  is located on the Pearl River	154
whom did Ted DiBiase defeat	974
Who has written numerous articles for popular magazines	1754
how does Aki watch the game 	1755
what is responsible for overseeing product development	1756
who  focused on the Lance Armstrong Foundation	177
what did Drywall offer 	1757
who worked for the Legal Services Corporation	262
What must The President of the Church be	1384
where does Ross live	51
who was awarded his Ph.D. in 1910	1758
where is Wrexham	60
Where is Cross back at work	1759
Where did Henry move 	33
Who is a regular contributor to NBCs Today Show	1760
who is also a master of Capoeira	899
Where is Lyman	60
where is Shrewsbury 	1761
what is a game for the PlayStation 3	1762
to what had Bush 's lead  increased	1763
What are Stock characters	1764
When did Chamonix host	1765
When do Sick animals often die	1766
What does Mine-a become	766
what make apperances	338
who may visit the Earth	1767
what is The Hunter Museum of American Art 	1768
What was invented in the Caribbean	532
What  is formed of nutmeg	1769
To what is PWU affiliated  	1770
where is A softball field also located 	1771
What is Bahamasair	1772
What is still in production	1773
who  died on 27 April 1270	424
What is Economic regulation	1774
Who is Flynn	431
How is Tigerlily seen 	1775
what exhibit a wide array of communication techniques	1776
how do Races differ	1777
as whom was Christopher Reeve cast	1778
What  have been found throughout Mesoamerica	1779
what is lost to dielectric losses	1780
what were blown down in Orangeburg	1781
What is Liberal	134
to where did The Armstrong family move	33
what is Benton Township	43
when  was Petra nominated	1782
what also has the option of debug output	1783
who was born at Loughborough	444
where would A report of the review  be submitted to	1784
What is today a part of Afghanistan	1785
what can also refer to KLM	1786
who was returned to active service	1650
What is an area in Italy	1787
what did Kissinger become	1788
where was Upsala College	1789
What was authorized on October 21 , 1972	1790
by what was The Medical College Hospital  inaugurated 	1791
who returned to Barrie	92
What changed its name to Laureate Education	1792
to what team was Rodriguez traded	16
What plays a mixture of rock 'n roll	1793
what is Japanese for 4	1794
to what may CMS also refer 	855
who  is attacked by Jorgen	1795
to whom did Newmark look up 	856
WHO is an icon of the West	1796
on whom  was a successful operation  performed 	1797
Where did Williams grow up  	194
with what is The Nintendo DS compatible 	1798
who was also a pacifist	178
when would Million be delivered 	247
where does The Los Angeles River start	208
What is a form of musical notation	1485
instead of whom is Father used 	1799
Where did Clapp also pitched	1800
who  has also choreographed for Alvin Ailey American Dance Theater	1801
who is also a noted collector of art	1802
who has The Tribune previously backed 	1803
by whom were Gymnasium then used 	862
What  should Cantonese remain   	1804
What is a multi-use stadium in Palmerston North	1805
what  was built in 1864	618
what does  Greece maintain	1806
who won by KO.	132
What was due to take place in 1944	1807
Where Christine Gregoire  grew up 	194
what is spoken in Wallonia	1808
what is Atkinson	60
what is materiality	1809
where did Millner grow up 	194
When was A third version  made public 	1810
what was A mech designed for 	828
Where is The Gates  	1811
What may Large motors have	1812
what do Locations include 	205
what were set up in Serbia	42
who were very popular in the Netherlands	1813
what currently has approximately 800 members	1617
who also have many options for boating	1814
on what Stephen took lead vocals 	1815
Who is Curran's father 	942
What is held in New York City	200
What is Roberts	197
on hom does Kendall develop a crush 	1816
What village is in Iowa County	197
when was Kossel awarded his Ph.D.  	1758
when did Lucas arrive 	1817
to what Ford appeared close 	335
what is Records	1818
who replied to Ali Akbar	1819
when was Charles Fort  declared a National Monument	806
In what is A B.A. offered  	726
where had Hannigan been 	1820
who  earned a Masters degree from the U.S. Naval War College	1821
What is Barrow Hill 	1822
of what is Renko a former municipality 	615
To whom is Downey home 	73
who is the head of the Secretariat	1823
To what are Passenger services  provided  	1824
What are Characteristic findings 	1825
Where was Colman born  	1
what  is an alternative metal band from Los Angeles	1826
who was a member of the Opposition Shadow Ministry 1990-93	139
who is now retired from NASA	1827
where is Gunnison	134
what is Rademacher	1342
where is Englewood	60
for what did Hungary prepare	1038
In what shape does A group of players sit	1828
what is surrounded by farmland	528
What is always a small tool	1829
What is a retailer of energy and energy services	523
What is one hundredth of a second	1830
who was a musician of great skill	1831
What is the population in Kajiado 	1832
how often are Nature documentaries released 	228
what said on March 9 , 2006	1833
what has been shown in the DC Animated Universe	1834
What is Jordan	197
What is Portlaw	60
what was recorded for Capitol	1835
to what score did Philadelphia go	85
what can vary depending on requirements	674
What was shot in Tokyo	1836
who comes out of retirement	1837
when was Main building  demolished  	295
what were Coifs 	1838
where were Tapings moved	1261
What is Irvine	1004
When did BBDO acquired the remaining shares	535
who made many contributions to rheology	1839
for what has Opera Mini limited support  	1840
what did Currey cross the street to 	1841
what did Fall do	1842
Who was an ardent supporter of Irish Home Rule	1843
where does Lisa go	85
What become a gathering place for directors	1844
Who is a lifelong resident of Timmins	1845
what did Wright attend 	516
where did Yeager die	18
who is a rapper from Philadelphia	1846
who was probably born in Flanders	1847
as what has Schwartz worked 	857
what first came to Montreal	1848
where is Stratton Mountain Resort  	1849
what station is on the London Underground	1239
where does Clay livex	1331
who returned to Lebanon	92
where did Coffin move to	33
What is to conduct trend analysis	1850
of whom was Sofia the half-sister 	720
who said of McGee	1851
for what have Educational programs been developed  	1852
Who died of an apparent drug overdose	459
where was Juliet born	1
Who  left in 2001	987
who was appointed Deputy Minister of Internal Security	1853
Who is an executive committee member of the Civic Party	870
who  was educated at Rugby School	143
what was solely a magazine	1854
to what  are Family benefits  related 	1855
when was The Royal Star produced 	1856
what  is a compilation album by Pentangle	1857
in where is The Clyde River the largest 	1858
what is Borah Peak 	561
what is White City	32
Whom did Johnny Storm marry 	1859
What is Hazel Run	134
where is Westphalia	1176
who transformed into Archangel	1860
where was Whitehead born 	444
What  is the sum of five consecutive primes	1861
by whom has DVD material  been released 	1862
In where did Girl Talk reach the top ten	207
when did Hemingway commit suicide	1863
to what did market focus shift	1864
where was Bratton born  	1
Whom did 42 staff serve  	1865
what is 5	9
what is Durabrand	1478
when was Arcana 23  held  	1866
what is Lake Sherwood	140
for what did Stars pay the price 	1867
what is Arabella	197
For what is Versioning also important  	1868
What is divided into 36 districts	376
where was Han born	1
when did William die 	424
Of how many seasons will Gundam 00 consist  	537
where does dad Take Cases	1869
what is Wood River	72
For what does 6.4 pay	827
of what Reynolds died 	459
From where did Lindsey graduate	1870
when was Brinkerhoff married 	1871
what sold the company to Eutelsat	1872
where was Stoddard born 	444
What can be found in A Midsummer Night 's Dream	1066
What  hospital is in Long Beach	117
What last accessed on December 9 , 2006	1873
Who is affiliated to the All India Trade Union Congress	1770
which  city is in Louisa County	134
what is currently shown on Boomerang	1874
what  is The North Pole 	544
what did Shilo have 	1875
where did Steve go to	85
What have taken place since 1915	1876
what begins with Thales	1877
who married to a businessman	1878
For what is Two meters required 	1879
who was replaced by Laurel Gand	1880
What is located in Macoupin County	68
where did Loy die 	510
When was Parliament summoned 	1881
what was in Rupert 's Land	659
who  is a perennial candidate for public office	1882
how don't Verbs vary 	1883
where is also home to the District Court	253
what  symbolizes the spirit of Vovinam	1602
where is Babice	271
who  is given an ultimatum	1884
Where have Herbs been donated to 	1885
who was named president	839
who took refuge in the USA	1886
when was The A3 first launched 	1887
What  is located in Hermann	68
who have played in four Final Fours	1000
who was born in Kiel	1
who was born in Hanwell	1
