Question	rel_label
Of what is The Prosecutor General the head  	1823
What is an international honor society for philosophers	2536
What were renamed the Blue Bulls	2014
who was born in Berent	1
What was released on June 21st , 1991	228
what is a town in the Breisgau-Hochschwarzwald district	60
what is for U.S. Route 1	1175
where did Sally grow up	194
What is Brandon Township	43
who suffered a variety of injuries	2537
Who did not attend university	2538
for what is A citation needed	2539
who tried to kill Creon	2540
Where is New Mexico	60
who has written a book	2541
what is a neighborhood in Houston	2452
when was The Victoria Racing Club founded 	308
what is most similar to Pascal	2542
who had been a member of the International Brigades	2543
What is a poem by Lord Byron	2544
Where was Carlson born	1
what township is in Brown County	43
to whom did Dr. Rice tell  	2545
who was a daughter of Richard FitzAlan	2486
who is Weaver	2546
What is obviously essential for long distance walking	2547
Where is MCA no longer used	2548
what stands for Armed Forces	578
What formed in late 1980	1924
what is Tarragona	1297
by whom was The United States  represented	2100
what does Mary do then	2549
who was Ruffo	942
what is an American hip hop group from Kansas City	2550
what is located at 266'27 North	47
What is Magnetite	2551
where did Vaughn see combat 	2552
for what is The River Thames the venue 	753
When was A special edition DVD released  	228
who grows up in the St . Louis , Missouri area	194
For what does A useful definition have scope 	2553
what does Huggies have 	2554
Who were travelling to Ghana	2555
when were Reforms introduced	113
What are organised in bases	2556
who was born in Kosse	1
How long do Episodes remain online	2557
where did Chalker see action	2523
Who had an intimate knowledge of men	2558
how is Shirk defined	2559
by whom was Vimes played 	2456
what is Langtang	60
who received his doctorate in 1929	2560
Who  has family in outer space	2561
what is WOPR	1485
what is OAG	1507
When will Series Nine begin  	297
what does Jalali have  	871
Who is Laughren	1845
what can Attrition also be mistaken for 	2562
Who is Byker	79
By what is Biblical text surrounded 	528
where is Musgrave Park	1390
how are 3	2346
Who walks into an elevator	2563
when will Contract award be 	2564
What does not carry colours	1503
Where is Lake Murray	2372
what has been in Lima	1820
what has Turner won 	2565
what  is divided almost equally between Catholicism and Protestantism	2566
of what were Three firms subsidiaries 	2567
where did Burman study philosophy	264
How many lived in Texas	51
who died in Memphis	18
what  can Elephants predict  	2568
for what are Airlines also responsible	2569
What are not allowed in Tent City 4	136
what  township is in Mower County	43
What starts with Rio	2570
who entered the House on Day 4	1063
Where is Jamestown High School	2571
when was Tsen opened	1228
What originally consisted of five members	2572
where did Kennedy begin working 	2573
How long is Sweat collected  	2574
Where is Hartwell	134
Where is Oranjezicht	850
When was The Dutch Reformed Church founded  	308
What can be a risk factor for bovine spongiform encephalopathy	2575
What is similar to certiorari	2122
what is the most famous tourist destinations in Kasargod	2576
What is Neptune Beach	134
what animals can compete in open stake	2577
What is Eagle Creek Park	2578
for whom is BVD now only 	2579
what are found in different locations	176
What  was released on December 28 , 2006	228
what is Indiana	140
for what team did Tom play collegiately 	2580
By whom is Mickey portrayed  	969
who ran out of bounds	1547
where Williams did grow up  	194
What also connects with Highways 2 and 732	1160
what is becoming a source of controversy	2317
for what did Hook form the Committee	2581
For what was Helsingborg qualified 	803
what was part of Cercle Brugge	9
Where did Artist commit suicide 	2582
what do Clients include 	2583
What is Macomb County   	9
What is a popular ingredient in pasta salads	500
Where is The Republic of The Gambia	2242
What are listed in bold type	482
What is located northwest of Bedford	2584
where is Lake Sherwood	140
who now lives in Scottsdale	1331
who had received the endorsement of Wayne Allyn Root	2585
who has limited support for JavaScript	1840
who was flown to Bangkok	943
where are Three young women bathing 	1148
To what does Renal cell carcinoma not generally respond 	2185
what  was from 6 am to 3 pm	359
what does Global Security Provide 	2586
what does The RTP header have 	2587
Who  then kills Chu	2588
Where did Halo 3 head	77
to whom should Articles be accessible	2589
where is Port Royal	60
What has The Village  entered 	2590
to whom did Fett pass the message	2591
who supports West Ham United	2592
what was Thompson granted	2593
What does Agnes Macphail become	2594
what  reported in August	2595
what has Fred Frith  composed 	241
who is a graduate of Cleveland State University	431
on what do Syntax and morphology also have a profound effect 	2596
where is Quest Aerospace	1423
when was Henry County formed 	950
what district is located in Tokachi Subprefecture	2597
where did Whiting die	18
where  has America Votes offices  	779
who listened only to Sorensen	2598
where Trials are not held 	1723
what sits without a jury	894
who  is a veteran of the Vietnam War	2599
who marched toward Luoyang	2600
who was Miletich	139
what supports populations of Chinook salmon	1172
Where was Gerhard born at	444
where did Beecher die 	18
to whom is Columbus home  	2601
where was Sessions born 	1
Of what Peugeot pulled out  	2602
to whom was Monarch sold	118
what was The French Empire  renamed 	2014
who was arrested on June 1 , 1989	2603
what made stops at Chesterfield	2604
When were Three issues published 	66
Where did Menndez travel	313
What is a variation of street basketball	2605
On what do Hen parties focus	177
What  are developing vehicles	2606
What does Macalester enroll	2607
From where did Tobias receive his Ph.D.  	2608
who  had recently moved to Bolinas	2609
Who  sailed to the United States	678
when did Grant receive his doctorate 	2560
who is also associated with IMPALA	1568
where did Thoma win five medals	1145
what never uses Simplified Chinese	2115
what was Slovenia	1362
Who became a board member of Technicolor	1429
Where had a population of 12,74,183	871
what did West do	2610
who was Clark	620
In what did Schiffer become fluent 	1360
What  is a song by the Red Hot Chili Peppers	507
what is located in Lakeside	68
Who played for the University of Florida	221
with what has Ishmael recently been diagnosed  	2611
to whom was Kildare assigned  	1197
What is not here for advertising of any kind	2612
what is Tanglewood	2452
where was Spence born	1
what did Alice win 	2613
What do SERPs usually contain  	2614
what was released on May 10 , 2005	228
what is comprised for four movements	2615
What were estimated at $ 7.5 million	1580
who  are used to Village pump	2616
where is Port Barre  	60
what did Von Papen lift 	2617
What was brought in for consultation	1683
Who took an immediate dislike to George Villiers	949
who was William Mitchell 	1685
What forms the western edge of Central Park	2618
How many men did not return home	2619
What went up from 50 to 68 hp	2620
where was Wycombe 	2621
Who are given lips	1884
for what are A total of 27 credits  required	2622
Where  is world famous for volleyball	2623
for what may Electric generators be used 	2624
who returned to Delaware	92
who was appointed President of the Panama Canal Company	2625
where was Edwards re-elected 	1893
What is the basic unit of measurement	2626
What contain about 4 % caffeine	2627
Where is McKellar 	211
Who is Guilty Simpson	1846
in what field does Glen hold a certificate 	2628
To where was VMTB-134 assigned	1197
when was A small church built	618
who played the role of Piya	555
what is Richmond station	1934
when was The Faculty of Law  officially established	2629
what had been reported on campus	2630
what is Colonial Country Club	2631
What has a syntax similar to C	2632
What came via the Corinthian League	872
what took place in Calgary	959
what  began in 2002	608
Who continues to struggle with post-traumatic stress	2633
what is Lunia	1645
where was Foulis born  	1
what are an English band from Greenwich	2634
What can be embellished with annotations	2635
for what is Valencia known 	1229
what goes to Snowstar	85
What was assigned to Sybilla	1197
in what was Rylander popular 	2636
 what does Seria look like 	2637
What airline is based in Ouagadougou	1772
by what court was The Oregon law upheld 	2638
who directs Bobby Fischer	2639
What was introduced in 1984	113
who  is a member of FOX	139
in what did KT invest millions	2640
Who takes control of the Liberator	1240
who  took over for Duff	2446
where did Mirza appear 	392
What is Oxo	2304
what is also applied to people of mixed races	2641
what will be organised in two clusters	1691
Who was born in Beijing	1
what was covered with soot	2642
what is Troy	134
in what is The MRAP also engaged 	2643
What has also become popular in the UK.	2644
What is  an indie band from Brisbane	2645
what did Maria still remain 	2466
What is located in the U.S. state of Georgia	68
What are provided to Aeromexico	1824
Where did Locke retire to 	141
Who becomes the father of 7 children	2646
Who died at Belton	510
as what can Pawpaw be used 	2647
what  opens in 1979	440
what did Senge study 	2648
Who was from downstate Illinois	359
what has many sites of historic interest	2119
what is The Yellow River 	2649
By whom was Malmsteen later replaced  	2650
where does exist Airspace	1105
What was founded there in 1871	2651
where did Dulany move to 	33
Where  was Molloy born	1
Where is Lely Resort	32
who was traded to Tampa Bay	16
What saw first light in 2000	2652
who was already in Elna	2653
What is Newton Highlands 	1285
who was formally appointed by the King	2654
to what is Zara also linked 	1169
What is Cable One	178
what doesn't prove things	2419
what is Oak Grove 	60
who died on 21 April 1941	424
When was A post office  established there	2655
what does n't Patrick Roy  have 	2275
On what did Crane focus particularly 	1545
What is full of intrigue	2514
who  regained control of the Minnesota House	2656
what include Lafayette	205
What is Duwamish	2657
What College was a private college in East Orange	1789
who looks around for Alex	2658
What does Mark Staff Brandl combine	2659
who was born at Gainsborough	444
what is a medium-sized breed of dog	2660
For which university did Levine play	221
Who was Mrs. Doyle	2661
What does exhibit high levels of endemism	2662
When was Mark born 	166
What is served by two airports	1514
Where was the royal capital of Poland	2095
How do Cancellations come	35
where  has Wissmann been active	2663
who died in Detroit	18
What is An adding machine	563
who is a frequent guest lecturer on Gerard Manley Hopkins	1912
What was restricted to Englishmen	2226
what is an inner-ring suburb of St . Louis	1761
for what does Yagan wait	2664
Who was incarcerated for 13 1/2 months	2665
who then moved to the VAB	1136
what is the official sport of Cuba	2666
what are required to graduate	2622
where was The Toyota Land Cruiser never built 	2667
what is written in ANSI C.	1106
What did go to Mario Manningham	85
What does Woods turn on  	2668
who studied electrical engineering at Helsinki University of Technology	556
how many attended in 2006	2481
who was born in Ovalle	1
who was dismissed from office	2669
what did Schuman also become 	2670
Who is the former mayor of Lake Station	2671
who  lived in Youghal	51
what was played May 26	1249
who is Simmons	1449
What flies like an arrow	2672
on whom had Ritter a strong influence 	2673
what is a city in Pawnee County	134
which country  had The US saved 	2674
What is used in dental implants	2478
What developed in South Wales	257
where is a popular destination for boaters	2675
what  was granted on June 4 , 1901	147
what was founded on 13 July 1970	433
what did Doumit suffer 	2537
where did Vanderbilt make his home	2676
for what was Carpenter ruled ineligible  	2677
what is high in protein	2678
what do Children have 	2679
when did Niazi die	424
where does Ascension Island lie	2294
Where was Albert	2680
who moved his family to Orland	2681
who have Women outnumbered 	1367
of whom does Ella make use  	2682
who can gain telepathic powers	2683
how is Velvetleaf controllable 	2684
who  had telepathic powers	2685
to whom is WAMM AM licensed	2686
where did East Windsor Township highlight	2687
in what is Sportacus constantly engaged	2688
who  is rushed to intensive care	2689
who moved to Philadelphia	33
what do Richard appear to be	2690
who  was sentenced to a prison term of 2.5 years	2120
Where was Cauchon born	1
What is Cooter	134
what was started on January 24 , 1983	2691
Who was born in Sri Lanka	1
for where did Randolph leave	997
what movie received generally mixed reviews	2692
What are common in plants	1981
what  town in East Feliciana Parish	60
What is Detroit	2693
who was actually looking for star talent	2694
what is popular in Doonbeg	546
What is Maryland Route 286	1226
who ran unsuccessfully in 1898 , 1900	2695
What has been upgraded to 3 megapixels	2696
of what is Azelaic acid a component  	939
who is Anah	2486
how long does ECM last	2697
how may Defendants be released	699
what officially opened in August	104
who  spent his childhood years in Bern	2698
when  was The Act repealed  	834
who took third for McLaren	2699
to where did Chichester return 	92
when did The Parkway open 	440
what is another reason for international migration	2700
What is Price	2701
who  left India in 1832	2702
for whom did Constantius call	734
What is Evans	2703
where do 25,000 live	51
who died on April 19 , 1949	424
What was also covered by Michael Bolton	2704
what did Ginger take 	2705
who died on 5 August 1877	424
where is Horizon High School Located 	68
what were founded in the Holyland	308
what was first written in G Minor	2706
What was a comedy of manners	2707
what did UPA pioneer 	2708
By whom is God accompanied 	2709
Whom  have Previous speakers included  	2710
Where is Babbacombe	498
Who was nominated for Best Pop Vocal Performance	2711
What are done in an informal style	2712
what is Rosales politically subdivided into	497
from what did Post-Impressionism  develop	2228
what is a major road in Scotland	2713
who then spots Anna	2714
who sat on pole	2715
what are numbers assigned to 	1197
when was Stow first settled 	2716
For what is Stroh the German term 	2717
of what is The College a member	139
what country was part of Russia	9
when were Emergency repairs completed	2718
Where did Celeborn and Galadriel travel first	547
who was Balor	2719
What are the most common type of anniversary	2720
to what was The Great Depression unkind 	2721
what  is a permanent form of female sterilization	2722
How many women occupy seats in the Parliament	2723
who is most famous for landscapes	2724
where was David Lilienthal  born	1
of what have Internet Kiosks been the subject	1629
at whom does Chucky start shooting	426
who  transferred to the New York Army National Guard	2725
What is chaired by the Chancellor	2726
what did Leisler name	2727
who was born in Bellefonte	1
who was an accomplished writer of fiction	800
what is a member of the National Collegiate Honors Council	139
what is the lower house of the Illinois General Assembly	2728
What is The Campaspe River 	1349
Where is Debbie currently based	2729
To what are Invitations sometimes sent	2730
who  proceeded to New York City	2731
what small market is town in Derbyshire	2342
What is New Troy 	2445
when did Inc. go public  	2732
to what can SOX be readily converted 	2733
who was a passionate lover of chess	2734
What was a structure in Ancient Rome	1440
what  are in Stage I.	659
what is Morganton	60
where was Bill Lewis  born  	1
Where was Powers born  	1
where is Ecru town	60
what was discovered in 1918	2735
what was seized without battle	2188
where is all surrounded by farms	1627
Who was the son of Matthew Stewart	942
What is a founding member of the International Freedom of Expression Exchange	2210
what is a tributary of the Cape Fear River	72
what were moved to Tuesdays	1261
who moved to Ohio	33
where is Bashaw Township	43
when did Operations cease 	1933
What sets the rate for federal jobs	2736
what were installed in 1958	443
Who pastored churches in Ohio	2737
Who remained in the Air Force	17
where did Adams die	18
What  is the main economic activity of people	1062
who was born in Billerica	1
Who is the Honorary President of the Katipunan	2738
what was built at Bodegraven	193
what happens to The Page  	1538
What is Flash Art	2739
What was Ishibe 	628
what has headquarters in London	2740
who is married to Jeff Richmond	737
to what four teams go down	2741
where did Beardstown move  	33
What is Karak	498
 what are Saddles	2742
Of what is People 's Republic of China also a permanent member  	2743
what were achieved by bridges	2744
What was Fuball-Bundesliga 196869 	2745
who often operate in secret	1441
when was Siddiqui detained 	2253
who were Sicko 	2746
when did Construction of the building begin	608
of what  is Lord Puttnam appointed Chancellor 	904
what is not a video format	173
to where Harris moved 	33
who was born in Pikeville	1
what has a growing population of 57,600	2520
where did Wolters return to	92
What was dominated by Minneapolis	273
What city is in Chase County	134
when did The FDA report 	2595
from where is Pasir Gudang visible	2747
what  call for a d2	734
what was The XM3E1 standardized as	2748
what was Inquisition	2749
who have access to horseback riding	2750
who was born at Missoula	444
What is a tabloid newspaper based in Lismore	2461
What  is divided between the Divine Office	571
when did The Wall Street Journal report 	2595
where does The Negro come to 	111
who  is non-executive director of Fibernet	2751
who was a member of the United States Conference of Mayors	139
how many times was Vaughan married	2752
who  fled to Belgium	1079
what  is traveling by raft	2753
who played football for the University of Michigan	2754
What  is pending for World Heritage Site	2755
what was the first creation of God cf	2756
who wrote on art	1596
in what is Kong put  	2015
where is The Beaver River 	72
Who was born in Woodville	1
what is Corona	60
fo what did Campbell write articles 	642
where were Cuttings taken to	364
Where did Koch die	18
What is a book for young adults	2757
to whom did Abbas reply	1819
what is an album by Jimmy Smith	466
Who is Michelle	2758
what is independent of capabilities	2759
As what  can ISO images be mounted  	2760
Of whom does Charles catch a glimpse  	2761
with whom did Gunn begin a feud	2278
what demonstrated its commitment to open markets	2762
who won a BAFTA for Best Adapted Screenplay	2763
by whom is The English translation published 	1499
To what are Unpublished works subject 	1471
Who was banned in the GDR	115
Who tested positive for an illegal substance	2764
what comes as a console program	2765
in what is Unagi high 	2678
Where is IGLYO registered 	2766
who has been licensed by Viz	2767
as what Ghana automatically qualified  	2768
who  eventually withdrew from The Gong Show	2769
Into what is Chungcheongnam-do divided 	376
to where does The Roman state now extend	935
What later became the State Transit Authority	2770
when was Schoolcraft College established	218
where  is The British Horse Society in 	659
what is highly dependent on foreign aid	2771
who pleaded guilty to misdemeanor charges	2772
What would Mourinho prefer 	2773
who is a graduate of Memorial High School	431
what is Maplesville	60
in what is Burns interested 	2774
what  was held on January 19 , 1971	312
what did Socorro  have	871
What has a Centre at Bangalore	999
who disparages the Faith	2775
Where do compounds play an important role  	1935
who was born on July 31 , 1936	166
what currently has a 6.5 % state sales tax	572
where did Nassau return to 	92
what is Xvid not 	173
who attended high school in New Brunswick	129
Who worked on research projects	2776
who has received numerous literary awards	2777
what are a professional basketball team based in Halifax	2778
Where was Liu soon	2779
what was organized in 1869	2215
What did Alibag have 	871
what is Naga administratively subdivided into 	1280
What is Coahoma	60
who are The Halifax Rainmen	2778
Who hits the streets of Los Angeles	1488
Where did Butler spend eight years 	2780
who was the most famous proponent of experiential education	2781
who chose the University of Washington	2782
who is also a musician	178
where  is nanook of the north released	1110
who  ca n't make pizza	2783
Where are Fiestas important 	538
What is in decline	659
where Johnson played college football  	219
by whom was The Green Room headlined 	2784
What were first described in 1908	2785
where is Sesame oil most popular 	1426
Where is Reedsville	60
to what is Justice also connected	2786
Where did Mikva attend	411
What was featured on MSNBC	1282
what BHS also offers 	2787
where did Beth start out	875
For what did Brown give his life	2788
what  opened in January 1992	440
what were dedicated in Hammond	2789
what is Estonia divided into 	376
What is in the Council of Europe	659
Who was the eldest son of George Wyndham	2437
how was Home diagnosed  	1317
Who released its first version of the Linux operating system	2790
What did B2B become 	1844
what is a symptom of metabolic syndrome	2791
Who is accompanied by angels	2709
what  set up by Derry	2792
To where did Gesner move back	1123
Who was born on December 5 1958	166
what is Bowie	134
What is Ilford	498
from where  are Buses available 	2793
Of what is Middle School composed 	2212
where was Rawls born	1
What resort is on Stratton Mountain	1849
What offers accredited undergraduate and graduate degrees	2794
by whom was Dan also coached  	2795
what can Headcrabs produce	2480
what does Wikipedia have 	2796
how long does A typical performance last	2797
For what did Medlicott hold the seat 	2798
What is Fgra	134
What was later opened in 1923	2799
who became known as El Tanque	2800
Who currently participates in the Adriatic League	928
Who began shipping in late April 2006	1931
Who took command of the Army of Northern Virginia	660
with what did Dale spend four years 	2801
ho was born in Cypress	1
who was cast as Superman	1778
What has M  	560
When did A revised edition come out	2387
what is a city in Galveston County	134
what is CCN	139
What was made public in 1826	1810
when was Ferndale officially incorporated 	346
What became part of Poland	1891
what team steamed for home	2802
Who was tried on 13 July 1770	1192
What is Hollyhock House	2023
what is  a western suburb of Geraldton	2803
what is a city in Prince George 's County	134
what does U.S. Army operate 	2804
What are named after chicle	2032
Where is The Theatre Royal situated	2805
what accounts for only 1.4 % of the GDP.	2806
what does McBride have	2807
where did Stagecoaches make stops 	2604
To what is Washington County  divided  	376
who was born in Smyth County	1
Who  have included Alf	2710
who retired on August 14 , 1894	2808
who are ordered to leave Florence	1218
whom does M represent	2397
Whom does Jericho then attack 	2809
Where was A Roman colony  established 	1252
Where is Marrs originally from 	2810
to where does The Search move on 	1096
from where have Pilgrims been traveling 	2811
what is St . Paul 's College 	1462
Where is Kumble situated  	83
in what  is Moses Cone Health System a recognized leader 	2812
To what had The NHL recently expanded 	1272
what was Williams charged with	2813
who was David Schwarz	942
What may A sentence lack  	2814
to where did Discovery then move 	1136
What received an Academy Award nomination for Best Animated Feature Film	2815
who was Sue	2816
what did Thomas change his name to 	1327
To what does A majority adhere 	2817
where is The A5130 	1226
Where was a factory  opened  	14
When was Tokugawa Iemitsu born	427
where did Ceremonial take place 	959
What is Holt	1489
Where did McClung grow up	194
what is Naze	197
What band is based in New Mexico	1419
What train station is in Windsor Locks	2818
who  are more commonly affected than females	2819
what Canadian rural community is in Inverness County	2820
where were Exteriors filmed  	1932
by whom is The City Centre served 	1514
who plays a set of twins	1447
what are Boolean operators 	2821
by whom is Tecumseh played	2456
What was completed in late 2007	1473
what did Deregulation change	2822
who had been in Munich	1820
where  is Karaoke very popular 	1813
What was released in May	1110
to what did Ulic surrender	2254
what is Elko	73
What have been elevated to Good Article status	2823
Who is tied for 5th place	2824
who lived in Box Hill North	51
Who died on December 24	424
what has Iran produced 	2825
what is the sixth largest city in Bulgaria	2826
when was The Third Eye published	66
when did Parchment become a city	2827
What took place on the Talladega Superspeedway	886
what was Tsuma	1288
for what is Product Management responsible	1756
what  is a term used to refer to coin grading	2828
to where did Brewster return	92
who was the son of Pelias	942
who had grown up in Queens	2829
What is the debut album from T-Squad	2830
what is used to express contradiction	2831
Who died on October 8 , 1962	424
who served until early 1997	57
What is the European version of the LG Chocolate	2832
who is Hansen  	431
What  are then available in a special directory	2833
who was Riley	2834
What museum is located in Long Beach	2835
Where was Marie born	1
What is in Hayes	659
What is Academics	815
who are bathing in a river	1148
What could grow to vast sizes	2836
what have been printed since 1998	242
Where is Bissell 	140
In what species is Imagination not only found	191
who was president of the Japan Society	620
who was William Cochrane 	2837
What is a village in Scott County	197
When did Gemini South see first light 	2652
how Compilation released	2424
where does A team become paramount	2838
