Question	rel_label
who was the child of older parents	2816
who  died in La Quinta	18
what is Peletier	60
What was estimated at 40,000	1580
When did Christensen leave  	987
where is Lincoln Park High School 	1557
where is Wellington	197
who  first appeared in Thor # 129	50
who was detached from Bromma	1680
to what is Geneva home	73
What is Devine	134
who was a United States Representative from Indiana	1685
for what is Melbourne Cup Day 	1175
Where is Neptune Beach	134
what were taken to increase war production	2064
what is Tumbes	3583
whom is Batman tackling 	3584
Who currently lives in Copenhagen	236
Who has an honorary consulate in Bucharest	3184
what does South Korea do	3569
who was born in Manciano	1
Who are contestants on Family Feud	2003
What town in East Lothian	60
what is the signature of civilization	1286
When did Ann Arbor  add 	3585
Where did Lane die 	18
what is crucial for a growing region	3195
what  is the second longest river in Western Australia	3586
when did Coutances follow suit	3587
what was sold to Blackpool	118
which country declared war on Italy	3588
What was Kingston 	60
with what  were Later models fitted	1670
who wrote the opinion for the Court	3589
how does Envoi end 	1223
what  were released in 1991 and 1992	1110
What has been a melting pot of religions and cultures	3590
what are manufactured by Bombardier	3270
who is the coauthor of three textbooks	3332
in what can Loneliness play a part 	3591
how many  were incidents of demagoguery	3319
What shifted its attention to the Philippines	3592
Where is Nulato	134
what is headquartered in San Carlos	101
What is operated by Metro Transit	439
What is Dabas	60
Who had the help of Haym Salomon	3593
who  was born in Pinsk	1
who won ahead of Schumacher	2839
Who starred in Exodus	1905
What can be done on meta	3594
where is Centennial High School 	2571
What must be in place	2151
What did EA eventually buy out 	408
where is M College 	2287
Where does Ciara walk into  	2563
where is Records	1818
What was bittersweet for Kasay	3595
what does Rampur have 	2004
What is The Kitsap Sun	3596
What is Chinquapin	140
whom did Chanos start investigating  	1051
What is Genetic engineering  	3597
Where do Queens of the Stone Age live  	51
Who sent a fact-finding mission to the Middle East	2192
What was done in Cuba	2712
what can Free radicals damage 	3598
Where does Mayfield now live  	1331
where was Dean Miller raised  	365
what show a score of Honors	1190
whom does 47 eventually kill 	3599
who was Karsh  	3162
what  are available from Secunderabad	2793
what are vacated in March 2005	3600
Of what was McCain also a member  	186
what does York become	407
who is voiced by Jaime Pressly	1158
who was knighted in 1935	1415
what is visible from Punggol	2747
where was James Dick born	1
What is Texas	3601
Where was Blair raised in 	365
Where does An American  find his niche	2017
Into what was Walton born  	3602
who  turned back to Canada	2177
Who is a member of the Labour Party	139
who  lived in Ottobrunn	51
Who becomes the first woman to be elected to the Canadian Parliament	2594
what is about verifiability	881
where does A skirmish take place	959
what did Poland become 	2211
Where did Isabelle use to go  	1949
What is Cricket	3603
Who was elected mayor of Chapel Hill	3604
with whom did Lambert continue working 	2494
What is the French word for environment	3605
Who  lost to the Toronto Blue Jays	913
What is Highley	3520
What uses estimates of population	3149
what does ZS stand for 	578
Between what were Performances divided  	571
what has received mixed reviews	2777
when was The Stardust  demolished 	295
To what do 95 % of graduates go on 	3606
Who called for permanent restrictions	734
Where is Marti headquartered	101
what did The Association cover	3607
what is Case Western Reserve University 	3608
who moved to Everton	33
who was a recipient of the Victoria Cross	2490
what is a mainstay of advertising content	964
what can be destroyed by voodoo	3609
where may Young individuals be found 	1294
who makes his way back to South Park	3308
What was subsequently acquired by Adobe Systems	1911
what does Governorate have	871
what began manufacturing in 1886	3610
Who was born in Dorrington	1
where is White Lake  	197
who asked for three books	1959
Where do Numerous islands lie	3362
To what had Miami never lost 	3611
What was a hurricane for less than a day	2005
when did Jackson leave the club	3456
Who was the seventh President of the United States	3612
how are Carlos	1059
At what temp. is NaK liquid  	3613
What is Manhattan	434
Where  had a population of 5,905	871
What is not part of Europe	3084
where is also home to The Progressive	253
who went to the Leipzig Conservatory	85
What can refer to a belief	3509
In Where is James based	232
what was Huracn responsible for 	3158
Who finds her way to Mobliz	3614
who played college football at Florida State University	219
To whom does Sunil get married  	275
Where is Kenilworth	850
What  is the research arm of The Ottawa Hospital	1027
What is Alcoholism believed to be	639
What is Rubber bridge 	3437
to whom is Fellows married 	737
who had spent time in Leiden	1990
what is Italian for crossbow	3615
what is De Witt 	134
who then makes its way to Babylon 5	3616
Where has BMX also become popular	2644
who studied music in London	3617
what did Kitaen take on	1182
which form does Jenova take 	3618
who is Comin' to Town	3619
When was A Truce signed	2380
when do Eastbound train arrive  	3620
who also has a lot of merchandise	3621
What is Laugh	3622
what  is R- used for	758
Where is Oak Ridge	197
of what is John 's head reminiscent  	3623
for what was Grace waiting  	3624
What was the setting for Game 4	223
on what did The Saints go 	276
what did not run during World War II	3625
Who only appears in the PlayStation version	2369
what is located in Tazewell County	68
when was Ebeid sworn in  	3626
what was dissolved on December 31 , 1992	3627
what did Faure co-found  	2286
What is The Civic Party   	178
where is The Documentation Center	659
What would be a prod	1751
what were later published in two books	1570
Where is Luck	3628
on what had Meinhof been working  	2146
What does Douglas Lake have	3629
what are something of an exception	98
when are Repulse Bay expected to open	919
where was Small born 	1
What is a namesake of Enfield	3601
Who was named to the Ring Magazine 's list of 100 greatest punchers of all time	2315
What had a population of 230,913	871
Whom does Tyson continue fighting 	3630
By whom is The Angel of Darkness	1267
where is Brandon Township	43
what comes to Paso Robles	111
to whom did Merson loose 	913
What is located on U.S. Route 40	154
What is home to the School	73
when did Dando retire	3381
where was Summers raised 	365
By whom was Food and accommodation also arranged 	3631
how could Rockets be 	603
what is tagged with original research	3632
when did CH2  officially open 	104
To what does Medelln now appeal	3633
what is JSP  	3634
Where are Ryan Homes  currently being built  	3635
what maintains embassies in the United States	3636
who was awarded the Navy Cross	3637
To what  is Crafty related	1855
who died in 1938	18
What did Lanegan become 	2444
Where is Rock Hill mentioned  	918
for what does Anne write occasionally 	3638
to what did Iowa stumble 	3186
what is a dictionary of Australian English	3639
who studied at Reed College	1087
What is Highway 80	3640
what is Payette	259
what are in Burlington	659
where was Perez interred	3641
What is  concerned with sanitary facilities	3642
who was the seventh of 10 children	1246
who was born at Glasgow	444
what may consist of three digits	3643
Who turned to crime	87
With whom is Quantico contiguous  	3492
where does Columba begin preaching	3644
where does Carillo split her time	3645
where was Rolfe born 	1
where is Trinity	1010
to what did Cleveland fall 	611
what  occur in odd numbered years	551
What have also been made in Scotland	3646
who formed the Committee for Cultural Freedom	2581
What is Over-exertion 	3647
what does The Conservatory offer 	3648
where does Dick currently live	236
what is Vaala	2061
who currently resides in Camden	423
by whom was The Dragon voiced 	1158
who was the younger son of Hon	3649
what year was a year of rain	3650
Where is home to the Columbus Destroyers	2601
What is Hartwell	134
What provides facilities for calibration	3651
Who defeats Tokugawa Ieyasu	974
what can be compared to subprime lending	3652
where have Bernie been printed 	3653
where did The Minneapolis Lakers play their final season 	3096
what is given to maintain blood flow	3654
for whom did 1994 start well	3655
what  was built in 1862	618
who  has been divided into 15 quadrangles	3656
What is a severe form of cellulitis	3657
with what was Lynch obsessed 	3658
by whom was West Africa dominated 	273
where did Axer move to 	33
When was Franklin Elementary built  	618
where is Dawsonville	134
who was a major part of Roman society	351
what is part of the Kokomo	9
what will be constructed in five phases	3659
who enlisted in the US Navy	404
Where were Scenes filmed  	1932
what were made available on a first-come , first-serve basis	3326
When did The Vale of Glamorgan officially open	104
what is a species of Osmunda	3284
where did Lippert grow up	194
where   is A branch library  located 	68
What  were later made available online	2378
for what  are Versions available 	21
who is Thoth 	2877
What was officially incorporated on March 19 , 1907	346
What is a play by James Joyce	128
Who came from the Habsburg family	1357
what was created on March 22 , 1813	1025
What is Opp	134
who was Manny	3660
for what is PBC responsible	3158
of what is The Connecticut State Senate the upper house 	1248
What is Slatina	731
who  took the idea to heart	1842
where is Montezuma	134
What is a northeastern suburb of Geraldton	2469
What is Gaula	1349
where is Mercer	60
when was Andy McNab born  	166
Where is Claysburg	32
To what  is Occurrence mostly restricted 	3661
what belong to Haplogroup T	112
what would violate ethical standards	3662
What is Friendsville	134
what  River is a tributary of the Willamette River	72
what is a trading center for machinery	1626
what  then crossed over to Boy Meets World	3246
Who changed his name to Trevor	1327
What did The Greek side  reject	3663
who attended Seminole High School	516
Who was the daughter of a tax collector	587
where did Talbott go to 	85
When were Mink seen	3664
what did Falconer write  	3665
who has been a sister city of Cambridge	3666
to whom did Ranulf write	946
who won the total-point series by 56-11	3388
What may lead to Barrett 's esophagus	2934
who was Jaishankar	3667
When was Jack last seen	3668
Where were 150 persons  washed away  	3669
Who is Brandin made into	1516
Where is Gladstone	134
what is Tottington	3670
What is limited to about 20 cm	2125
Whom does Geoffrey introduce	3671
with what is Human sexual behavior tagged 	3632
When was 50.8 formed 	950
what did Kingpin receive	2692
What was founded on 7 June 1947	433
who had been a friend of the US President	3672
to whom did Topeka become the home	3673
with whom did Loose women  have sex 	654
Who  has also played for the Oakland Raiders	681
what are translated to physical memory	2535
On what has Index little effect	3674
What usually have exclamation points	3675
to whom does A neighbour  call 	2320
Where Maggie participated  	2871
who is Faith	1221
What is is a letter of Old Norse	1624
When Albina finally opened  	3676
where is Ostrom	197
What is the fourth album by Sodom	3677
who spent his childhood in Odessa	3250
who won the endorsement of U.S. Senator Barack Obama	1967
to where Miller did find his way  	972
In where is Trash a fictional organization 	3678
Where is a great destination for surfing	3679
what  moved its headquarters to Research Triangle Park	3680
What was Excellence  	3681
what did The West Indies do	590
what is Joyner	1010
For what is Alemany known	1229
what include a search for near-Earth asteroids	3682
who is Mr. Factor 	431
Who grew up in Mission Viejo	194
what began in Portland	608
What is the manipulation of genes	3597
Who moved to Mexico	33
What is important in music	538
What describes the People of God	3683
how long may Fence height may up	3684
for what is Vranje also known	2941
who is Jonathan Archer	2141
Who was born in Baku	1
when did The Little Mermaid open	3085
by who are Six of the songs performed	3685
when did A North American tour begin	608
who was the bullpen coach for the Toronto Blue Jays	3330
who has made the acquaintance of two young brothers	3686
what is Sin	3687
What was created by NeXT Software	693
who died on October 2 , 1950	424
when did Burns die 	424
what is Dahisar	1315
Where was McCormick born  	1
what was arranged on 28 October	1727
where  can Vote fraud  also take place	3688
what is Sleep	1485
when was A Catholic Church  built	618
what did President Franklin D. Roosevelt address 	3689
who splits her time between Naples	3645
what village is in Buffalo County	197
what can The Samsung Q1 hold	1270
Who was named club captain	839
What do Modes also include	250
where does Cyprus have an honorary consulates 	3184
What is located at 4448'32 North	47
what does East New Britain  cover	3690
Who was born in Peterhead	1
Who was Chief of the General Staff	3691
What performed in Memphis	489
Where was Ives from 	359
Who became a director of the Bank of England	3692
for How long does Ben leave the country 	1053
who died in New Canaan	18
For what does Beulah Park take over  	2446
what did The Federated Suns destroy 	3693
What is an Afro-Asiatic language spoken in Bauchi State	3694
when was Issue Five announced 	3695
what was founded in 1959	308
where do Dungeons appear  	392
For what did CDI drop	819
who turned professional in 1979	416
Whom did Lambert marry firstly  	430
what  is an indication of peritonitis	3696
who  lost to James P. Johnson	913
What was founded in 1908	308
up to when  were Seven of them  used 	3697
what is part of WikiProject Cambodia	9
who is appointed Master of the King 's Musick	485
where has LexCorp been shown	1834
When was Family established	3698
What is an unincorporated community in Ozark County	140
Where is Hillside Cemetery located 	68
what is two blocks north of Union Square	3699
who  quickly becomes friends with Michael	3700
what is Newhall	1288
In where do 1466 people live 	51
who  was born near Kirkwood	19
what is often mistaken for flash flood	3092
what is Jasper very interested in 	3701
When was Ground broken  	3702
where was Aelred born 	1
Of what has Music always been a part 	3414
what does The School have 	3703
who became Minister of Internal Affairs	2500
What is a postcode district in the SE postcode area of London	3704
who was born on February 16 , 1953	166
what is The Monetary Policy Committee 	3705
What received Royal Assent on 12 February 2007	3706
of what did Dunne become a board member of Technicolor	1429
how long had The Air Force Academy only existed	3707
who was vehemently opposed to the Johnson act	3708
What is Taftville	271
Who was later replaced by Steve Vai	2650
What was Palm denied 	3709
what did Cabaret sign to 	1551
what is A self-portrait	689
To what did Armitage change his name	1327
By whom is John Paul portrayed 	969
Where was Ying born  	1
Where is Vahdat	134
who is contemptuous of Horton	3710
what is Peak	60
What strikes in Rome	934
when was The NMP founded 	308
where is Maltby	1822
Where was Discontent spreading	3711
who was picked up for a European release	1430
who became a fan of science fiction	888
Who is LaHood 	139
Whom does Crowley predate	3712
what was Holton named 	839
Who pays another visit to Jade	3321
where was Benigni born	1
what are Property taxes 	3713
who was Gretchen	3278
what made up 39,000 hectares	906
when did Lokmanya Tilak visit the school 	3714
what is a measure of internal defects of a diamond called inclusions	1337
who was born in Sevier County	1
What was established in 1937	218
What is a radio station licensed to Saginaw	3496
Who was born in Langkawi	1
With what does David continue to struggle 	2633
What is Positano	3715
who graduated from Wichita State University	1870
what did Albertus use in	1061
where did Michael serve	3404
Where is Jacksonville	197
What is often confused with Murata Manufacturing	233
What is Colfax	197
What may also trigger an attack	3110
What is also available in Hope	3716
What are Local breweries enjoying 	3717
when did The Heralds play	2252
who started his career at Bangor	2081
What are typically measured in volume	1661
who is not the same character as Robin Hood	3718
What have been developed for schools	1852
What is Coronation	91
of what does Culture consist	13
who began working for Benito Mussolini	2533
What is the third studio album by Dido	3553
what Birds aren't  	173
From when did Mr. Clutter serve	3719
who  brought to justice	2872
Where was McLeod born   	1
who addressed a joint session of United States Congress	3689
to what is the Fight song similiar	3720
Who had an amateur record of 157-17	1501
what  is an association of independent physicians	3721
what is Nebraska Highway 56 	1093
who catches sight of Shirl	754
Who became an ardent supporter of Louisiana State University	2984
who were forced back to India and Ceylon	3722
what is Worthington	1590
what has been annexed to San Jose	3723
where did Carolina return to 	92
What adheres to Sunni Islam	2817
When was Fulton County formed 	461
When did Jones left the ministry 	3724
Who is based in New York	232
what did Specific charges include	3725
who was the son of an engineer	942
where did Hayes appear	392
when was List arrested 	2603
who moved to Minneapolis	33
what did Walt Brown participate in	2871
What does Palos Heights  have 	1559
 Who joined in 1981	868
In what language does Choate offer courses 	3227
what was slighted in 1644	3726
who is well known for surfing	2914
when was Anton Chekhov born 	166
what writes the rules of play	3542
how did Long prevail 	3727
what was held in Johannesburg	3728
what did Professor Wilson publish	3729
how did Two of the members die	18
where  were detached houses  built	618
Whom did Hal Jordan become 	657
when was The American Physical Society founded 	433
who was born on March 17 , 1901	166
when  are Blood transfusions given	2956
who died in Slapton	18
who was Zorin	3730
Where is Harlem	134
where was Scheiner 	659
what is The Kamo River	1349
what was offered by the Belgians	3355
where is a mainly residential area of Edinburgh	3731
what has The South Side had 	3732
who  was born in Lyons	1
What are commonly found in science fiction novels and stories	3733
what were finally restored in 1991	3166
in what did Raup believe	1644
what have Various saints had	3734
who currently resides in the Berkshires	423
what  took place in 1958	959
to what was Krasicki elevated  	3361
which borough is in Passaic County	350
for whom has San Miguel been notorious 	3735
what is an agency of the Office of Public Health and Science	2137
To whom  is Henkka completely dedicated  	3736
who had moved back to L.A.	3737
what is Steel	3738
who studied music at the Longy School of Music	3739
To what does Open For Business add more functionality	2318
To where was Stillman removed	583
what later increased to sixty	3740
since when has J Smithsbeen operating 	1623
where is White Oak	32
when was The Iconostasis added in 	549
what serve Warner Center	626
where was Heseltine educated 	143
When did Don John die	424
what  broke up in Denver	2251
who is American Dream	3317
Who  died in August 1860	18
who was voiced by Rachael MacFarlane	1158
where is Pioneer	197
what headed in different directions	3299
From what did Power output go up  	2620
who was mortally wounded on May 5 , 1864	2391
what was represented by Kenneth Starr	2100
to what are B vitamins also commonly added  	1963
what broke out in 1541	2431
who  is now a director of Gunns Limited	29
what is TNT	3741
what  census-designated place is in Muskogee County	32
What must always be used with care	3742
Where was Hass born	1
what announced on 9 January 2008	20
what is the location of a number of godly realms	1645
Where is The Maremma 	1787
What have been known as the Frontenacs	3743
who was the youngest daughter of Ernest Augustus	3744
whom did Anna marry 	1859
where was Wagner born	1
What is not used in diesel engine	3745
what introduced a number of new characters	3746
what is Cultural Survival	1466
What include the passing of Irreversible	1115
For what did Logan test positive  	2764
What means nothing in English	3747
who was Luis	3748
What does Rice bran also contain 	3571
Who tend to busk	2044
What did Thelwall become 	3749
who were summoned to Parliament	3750
who returned to Venezuela	92
Whom does catman hate	1536
what  was established in 1873	218
Who has also mentioned Budi	2365
of what has The Catholic Church  also been critical 	1065
Who ran for three years	1664
where did Ivy play college football 	219
where was Bing Crosby married 	2752
What was transferred to Fort Union	492
what  is similar to diesel	2122
whom did Richard eventually chose 	1308
with whom did Dotti have one child 	3751
what would The Mayans be 	1751
what  uses a variety of techniques	3752
where is Pompton Lakes	350
where do Two members still live 	3753
Who won in a 6-0 blowout	287
where has Kutty served 	884
What is another brand of broom	3754
who defeated Hulk Hogan	974
what was Bartow County originally named	1450
for what is Archie hospitalized 	1318
Where is Friendsville	134
what does Madeleine Albright have 	2238
what are added by template	3135
What contains a climbing wall	3401
when is Confetti scheduled to be released  	3755
How long did Emperor Akbar stay here 	3756
Who served from December	3719
who are Ulster-Scots	3757
what is Arlington High School 	3758
who  is the founder of SMALL	1064
What is the local term for white doves	225
Where was Ho born 	1
what is politically subdivided into 43 barangays	497
for how long did Jevan Snead pass	3446
what are also famous for a dog breed	3759
What is a member of Premier Hotels chain	139
Who is Fukuyama	640
what call for four players	734
 what  is Sogod politically subdivided into	497
where was Samuel Moore born 	1
who suspended by Rams	3760
what was Putnam also active in 	3761
Since when had McArthur held the seat	3762
Where is Corbu	6
for what are Page numbers required	1879
what is a general practice law firm located in Elmira	2703
What is Hairpins	259
how should Hatchlings be fed 	759
What is Calen	91
Who was born in Blackburn	1
who  submitted to the Mother Confessor	3070
who was established in 1904	218
who died due to an overdose of sleeping pills	3398
What are listed in red	482
Where  is CBD found	176
What  has A friend suggested 	3763
what was first conceived in 1987	1614
From what do Leather gloves  provide protection  	3764
what age does Drinking age stay	2069
with whom does Buddy quickly become friends 	3700
where was Waring born	1
what is Visibility	3765
where  is International Headquarters officially dedicated	1009
Where did Mann travel extensively 	3766
what appeared in 1833 , 1838	392
what is Chikuzen	628
where is Severe weather a concern 	3767
What is Newton-le-Willows	3498
who returned to Alameda	92
What condition has an autosomal dominant pattern of inheritance	3768
what is a newspaper published in Chicago	749
where can Forms also be exported 	3769
who has recently been diagnosed with Acute Myeloid Leukaemia	2611
Where is Irwinville	140
what is made in China	2152
by whom was Victoria enlarged 	3770
what is a town in Maricopa County	60
how much population did Amay have	3771
when  has Filming begun 	3772
Where was Ltd. established  	218
when did Wise die	424
of what does SMTP consist 	13
what does Psychology explore	3773
To what  were Eindhoven promoted	1114
who hosted the first season of America 's Got Talent	222
Who played on hundreds of records	3774
who is Marinelli	2599
what does The Transmission Control Protocol provide 	3775
what film won an Academy Award for Best Writing	3526
for what have The Newfoundland long been used 	3776
What is a kind of wild cat	3390
what ceased in 1983	3777
who sent envoys to Knoxville	1171
where  is English teaching a big business 	2052
where is Sandia	32
What created a number of unanticipated consequences	1054
for what Bradman gained  	3778
who is also active in the Netherlands	3761
what's  a name of French origin	3003
What is Morristown	197
Who was born in Placetas	1
when were Twenty built 	618
what ceased operations in 1945	3779
what is Westlake	134
What do Disabled celebrate  	1046
who committed suicide at hotel	2582
What is for an eye	1175
what are the source of Indian culture	3780
how many went to the Congress	85
Where was Blackburn born	1
What is the eighth album by Michael Jackson	3781
what do Younger children have 	3782
What  also moved into Manhattan	3783
who led in Pulaski County	3784
When did Construction work  begin	349
what won in 1984	287
when wasKephart  decommissioned 	3785
What  set up a sister company	1437
when was The College of Nursing founded	308
What is Inco	3786
what was constructed in 1872	953
where had a population of 98,403	871
where does Adria set course for 	3477
what is Education	2700
For whom is Future now	3551
How much of this is working farmland	2038
Where was the home to Charlotte Hughes	833
To what may Civil law  also be compared  	1622
how must Rollback always be used	3742
who was James Lawrence	853
What is no longer used in new designs	2548
who was awarded the Silver Star	3637
what was founded in 1913	308
where does McIntyre reside	423
Who ended up in the United States	3787
What was released on 13 June	228
who was born in West Chester	1
What  is the location of a military academy	1645
As what is Polaris also known  	1230
What is Massachusetts actually considering  	3203
what was Brahma again moved to 	3788
when  was The U.S. patent  granted	147
where was O'Leary born 	1
who survived thanks to American universities	2233
what Longevity is about  	881
who sells a variety of doughnuts	3789
who have the right to participate in a trade union	3790
